{
  "schemaVersion": 1,
  "protocolVersion": 1,
  "serviceVersion": "2.0.0",
  "network": "CryLoNexus Testnet",
  "chainId": 5546,
  "nodeId": "example-node-public-identity-0001",
  "operatorAddress": "0x1111111111111111111111111111111111111111",
  "startedAt": "2026-07-01T11:00:00Z",
  "updatedAt": "2026-07-01T12:00:00Z",
  "lastHeartbeatAt": "2026-07-01T12:00:00Z",
  "connected": true,
  "rpcHealthy": true,
  "walletMatched": true,
  "registered": true,
  "tier": "Operator",
  "uptimeSeconds": 3600,
  "rewardEligible": true,
  "verification": {
    "connected": true,
    "verified": true,
    "verifiedAt": "2026-07-01T11:05:00Z",
    "reasonCode": null
  },
  "metrics": {
    "heartbeatCount": 120,
    "successfulChecks": 120,
    "failedChecks": 0,
    "pendingRewardsBaseUnits": "0"
  },
  "workers": [
    {
      "name": "rpc-health",
      "healthy": true,
      "lastRunAt": "2026-07-01T12:00:00Z",
      "successes": 120,
      "errors": 0,
      "messageCode": null
    }
  ],
  "warnings": [],
  "errors": []
}
